key,description,is_mandatory,is_cumulative
category,Desired category of the clothing,TRUE,TRUE
brand,Desired brand or manufacturer of the clothing,FALSE,TRUE
design,Desired design or style of the clothing,FALSE,TRUE
occasion,Occasion or event associated with the clothing,FALSE,TRUE
material,Desired material of the clothing,FALSE,TRUE
price range,Desired price range of the clothing,FALSE,TRUE
size,Desired size of the clothing,FALSE,TRUE
others,Any additional constraints or preferred features.,FALSE,TRUE
