key,description,is_cumulative,in_explanation,default_value
location,The desired location of the restaurants.,FALSE,FALSE,None
cuisine type,"The desired specific style of cooking or cuisine offered by the restaurants (e.g., ""Italian"", ""Mexican"", ""Chinese""). This can be implicitly provided through dish type (e.g ""italian"" if dish type is ""pizza"").",FALSE,TRUE,None
dish type,The desired menu item or dish in the restaurant that user shows interests.,TRUE,TRUE,None
type of meal,"The desired category of food consumption associated with specific times of day (e.g., ""breakfast"", ""lunch"", ""dinner"").",TRUE,TRUE,None
price range,The preferred range of prices for the restaurants specified by the user.,TRUE,TRUE,None
wait times,The acceptable wait time for the user when dining at the restaurants.,TRUE,TRUE,None
atmosphere,The preferred atmosphere or ambience of the restaurants.,FALSE,TRUE,None
dietary restrictions,Any specific dietary limitations or restrictions the user may have.,TRUE,TRUE,None
others,Any additional constraints or preferred features.,TRUE,TRUE,None
